tweet_id,safe_text,label,agreement
MBZU8RC3,VACCINATE YOUR CHILDREN PLEASE PLEASE,1.0,1.0
EJJMSIMJ,Another Study Finds No Link Between MMR Vaccine and Autism url,1.0,0.6666666666666666
6TKX42DD, good to know you like to play Russian Roulette Meanwhile Ill vaccinate my kids,1.0,1.0
6ZYLSVFI,I need disneyland now give me measles I dont care,0.0,1.0
A15AWH9S,Officials confirm fifth measles case in Clark County An infant with measles is the fifth confirmed case of the url,0.0,1.0
E8NV22JO,SNL hasnt been funny in as many years as I havent vaccinated my children,-1.0,1.0
LD7P8Z63,And just how does a Christian church define outsider I thought Jesus welcomed all religion Measles,0.0,1.0
C6HL40MM,I shop here Felton New Leaf employee confirmed to have measles health officials urge precautions url wtf,0.0,1.0
E3H85V5U,Measles is deadly but can also leave children blind deaf and brain damaged vaccineswork,1.0,1.0
2GX3B4OI,Screw you Gov Rick Perry The vaccination of children is a decision that should be left up to parents not the govt mandatoryHPVvaccine,-1.0,0.6666666666666666
2NW6RIPT, threads public but I respect your pov not to get involved Its impossible to have friends who died of measles last decade,0.0,0.6666666666666666
SXDU4ITG,California lawmakers aim to limit vaccine exemptions url,1.0,0.6666666666666666
5XPZ28ZL, vaccine truth url,0.0,0.6666666666666666
YQCPP2TM,Modified measles virus destroys cancer in early clinical url can this turn measles into a new virus and cause pandemic,0.0,0.6666666666666666
WSEEG8UH,Getting the measles vaccine is much safer than getting the measles infection minutestruth AAP getvaccinated,1.0,1.0
UNQ8GLMM, Fascinating stuff Have you seen how the measles virus is being uses to fight cancer Watch the Vice special on cancer ,0.0,1.0
RZLOKAD7,Yes but we have chosen a delayed schedule Are your kids vaccinated Why or why not Tweet your thoughtsquestions,0.0,0.6666666666666666
CLK1QITW, I went and took my son to doctors and he got immunizations and got those autism Jenny McCarthy jaymohrsports,-1.0,0.3333333333333333
O24I9WYT,If you dont vaccinate your child and my nephew or any child I love dearly gets sick I will hunt you down Just saying,1.0,0.6666666666666666
OU7NH44L, vaccines if you choose not to vaccinate you should have to home school your kids Period vaccineswork,1.0,1.0
NBM8XP2G,It is so cruel to give infants shots Why cant they make only oral vaccinations for children under the age of ,-1.0,1.0
1ZADWZFU,Ineed to get my TB ampMMR shots done,1.0,1.0
0CXNZ75X,First case of measles in shastacounty in at least years Yikes,0.0,1.0
8EIN091C,Immunization Clinic PM Come joins and get your immunizations up to date West Ridge Middle School url,1.0,1.0
CODMHST1,Kids night at Earthfare Time to watch parents douse everything their little angels touch with sanitizer preventing them from immunities,0.0,1.0
F9AQYZQ8,Immunizations That Most Schools Require url,0.0,1.0
SFS3MX8S,Measles outbreak underscores need for continued vigilance in health care settings url,0.0,0.6666666666666666
UC9N6M1Z,HB NEW Schools immunization rate website posting url,0.0,1.0
9SAVTAZC,Hey sciencedeniers ya happy yer antivaccine stance has allowed measles back in the population,1.0,0.6666666666666666
AU40AD91,Just pulling into Disneyland We put a sign up where you pay for parking Sign read NEW MEASLES OUTBREAK Nolines,0.0,1.0
9B3N8449,Report infants too young to get vaccinated contract measles Nice work AntiVaxxer youre so close to causing some deaths ,1.0,1.0
IFTNG8WR, I dont vaccinate my children amp my mother never vaccinated me However I dont the issue is black amp white and Im not everyone,-1.0,1.0
IK2TXXBM,Lets go to Disney and get measles,0.0,1.0
JI37P4VS,Larry Minard questions health board on kids vaccination rates in county Almost vaccinated Amy Thoreson of health dept responds,0.0,1.0
FE3DAH3G,Now they will try to discredit her Vaccines and autism a new scientific review url,-1.0,0.3333333333333333
MKJL53RY,Six Confirmed Measles Cases in Cook County url,0.0,0.6666666666666666
IEC2I9ZX,On average people who complain live longer Releasing this tension increases immunity and boosts their health ,0.0,1.0
4XXO8DPW,Marley amp Measles MakeAFilmUncomfortable,0.0,1.0
PD5DKDO9,According to a new study vaccines are NOT linked to longterm effects in kids url,1.0,1.0
7T27KK8L,Shauna Weatherby recommends talking to your doctor abt your sexual health and getting your children the HPV vaccine CS ,0.0,0.6666666666666666
FDKDOWJB,And you know WHY these diseases like measles were eradicated CAUSE WE GOT FUCKING VACCINATED GET IT TOGETHER PARENTS,1.0,0.6666666666666666
8LUJTDKM,Another Study Finds No Link Between MMR Vaccine and Autism url,1.0,1.0
4P8VVUGW,arent measles parties like chicken pox parties why are ppl intentionally making their children sick,0.0,0.6666666666666666
V74MY35L,borrowed What if the cure for autism is a vaccine thingsthatmakeyougohmm,0.0,1.0
3OMN5PG3, theview its not funny Its serious they actually said they dont know cdc but measles will kill autism doesnt,1.0,1.0
5GRH6V1A,Look people we never had a measles out break until Obama let all the illegal children in Lets put the blame where it belongs,0.0,1.0
3VND7OQT,Why is there an actual debate on vaccinating your kids Its a nobrainer Like calling running plays from the halfyard line,1.0,1.0
RCDKYTTW, got fameoliverxx in here snapping Life Different When You MADE MMR url,0.0,1.0
NAKRBNC6,Only of people in Disneyland measles outbreak were unvaccinated but its their fault claims propaganda url,-1.0,0.6666666666666666
5LHW5IMM,The isolated measles outbreaks could be so much worse if people just stop vaccinating their kids People die from this its not a game,1.0,1.0
KTEJ5D7O,Like the proof you have that illegial immigrants are to blame for the measles epidemic ,0.0,1.0
T72QZIG4, do I get an MMR show this summer,0.0,0.6666666666666666
A4E6PSRS,Just found out Ive outlived my measles vaccine Guess what I get to do I hope they give me a lollipop,1.0,0.6666666666666666
UNHTP8NC,San Diego parents react to controversial vaccination bill It is public health versus parents right after the url,0.0,1.0
924IYQJH,Vaccinate your FUCKING kids,1.0,1.0
VIE7GI9K,Oy Doctors say you should vaccinate your kids but the guy from Deuce Bigalow European Gigolo says otherwise url,1.0,0.6666666666666666
N77DFZ8V,Dude if you havent gotten a measles vaccine Dont travel where its prevalent then come back here Gross,0.0,0.6666666666666666
52UR71N6, measles cases linked to Disney theme parks in California Seven Californians and two people in Utah have url,0.0,1.0
BSFTD1L3,Yesterday someone on FB had the gaul post vaccinations dont prevent diseases U know like polio pertusis german measels etcFacePalm,1.0,1.0
BRYAJJJ9, lets start worrying about getting freaking measles MeaslesOutbreak,0.0,1.0
BS6MOKJH, My grandsons pediatrician acknowledged his vaccine injuries amp provided a waiver voluntarily that he not receive any more vaccines,-1.0,1.0
WR5VTDH2,If you dont vaccinate your kids you shouldnt be allowed to have kids,1.0,1.0
8SI149NO,Arkansas just removed students from school that did not get there required immunizations Good move AR I rarely get to say that ,1.0,1.0
55327980,I AM LAUGHING SO HARD BECause PEOPLE WHO DONT VACCINATE ARE MORONS OMG WHOOPING COUGH KILLS INFANTS LIKE JESUS url,1.0,1.0
39RJI5QQ, i thought it was mandatory law to get your children vaccinated,1.0,0.6666666666666666
NH36I2LY,Okay episode over Remember vaccinate your kids Dont be dumb Itll save you a lot of possible true down the road,1.0,1.0
8PDFOW6Y,Here is Penn amp Tellers graphic illustration of vaccine safety beware some graphic language url,1.0,1.0
7KVU1FIU,So glad to see discussing vaccinations amp measles outbreak nerdland publichealth,0.0,0.6666666666666666
57Q7SY19,Health department holding backtoschool vaccination clinics url bdcnews,0.0,0.6666666666666666
Y6SB314G, people can chose how to raise their kids but when does the public matter Parents dont vaccinate amp other kids get sick,1.0,0.6666666666666666
886QAC8F,AZ confirms additional cases of measles Additional community exposures identified url,0.0,1.0
D6QPS33A,Hm Must be a weird coincidence RT Measles in US by state before amp after vaccine was introduced url,1.0,0.6666666666666666
OBF9ZAZY, ur gonna get the measles at disneyland,0.0,1.0
S2MAJJ0S,Parents seek more exemptions for WV vaccinations url Most read by neighbors in AnitaHeights Huntington,0.0,0.6666666666666666
AU25H8WB, Possible case of measles reported at Philly museum url,0.0,1.0
NZDN0PSW,On average people who complain live longer Releasing tension increases immunity boosts health I AM doin somethin right,0.0,1.0
9HCI6PN1,Long term study of k shows no link between vaccines and autism url stop being an idiot AntiVaxxers,1.0,1.0
YI5QW237, Why We Didnt Vaccinate Our Child url so much truth,-1.0,1.0
S8UYAV4W, Close to it isnt it Sandy Sad very sad I dont believe in forced vaccinations period My kids couldnt do Pertussis,-1.0,1.0
Y6YNV2MN,Vaccinate fat kids ScandaI,1.0,1.0
592B64M1,National Infant Immunization week is April thth Lets take care of our little ones,1.0,0.6666666666666666
P7CZ246M,Opting Out Of Vaccinations Requires More Paperwork For Parents Parents in Colorado who dont want their children url,0.0,1.0
839Z6Z43,If parents stopped feeding their children thinking it was unhealthy theyd be charged with neglect Why cant we do the same with vaccines,1.0,1.0
ZKD5UOBV,Every child should be vaccinated closetheimmunizationgap health vaccination url,1.0,1.0
Q021WBLX, there are no legitimate studies showing any vaccineautism link Anecdotes amp small prelim studies dont count,1.0,1.0
5KJ6SF8X,Backtoschool fairs offer information immunizations Parents are invited to attend three backtoschool fairs url,0.0,1.0
V7ND06ZG, We cant even defend our own citizens against whooping cough amp measles anymore Thanks ,1.0,1.0
GCJ95GRL,So tired And we still have band rehearsal for hours at MMR Disneyland,0.0,1.0
16ZZDW9H, Majority of Americans want vaccines to be required as measles outbreak grows url ,1.0,1.0
POXSHLSC,National Infant Immunization Week Busting Common Myths About Childhood Immunizations url,1.0,1.0
2MH0OIYF, how tf did I get stuck with crystalkins that sounds like a vaccination for the measles or some shit,0.0,1.0
GVYX41JA,Measles takes a political turn as lawmakers wade into vaccine debate via ,0.0,0.6666666666666666
AXIE5AEC, my children do not get vaccinations and they do not get sick like other children either,-1.0,1.0
X7942GPD,HR Passed Recognizing the week of April through as National Infant Immunization Week in Penns url,1.0,0.6666666666666666
N16YKKMK,The vaccineautism myth url,1.0,1.0
1VVWG6TN,La Salle Nursing Professor Not Getting Your Children Vaccinated Endangers The Health Of Your Community url,1.0,1.0
NU6WPMZ6,Why is there an actual debate on vaccinating your kids Its a nobrainer Like calling running plays from the halfyard line,1.0,1.0
9G0R7UUU, how dare you dismiss my vaccine injured child,-1.0,1.0
M3J3R2A2, koalas in San Diego zoo are all vaccinated for all diseases upon birth,1.0,0.6666666666666666
GC2D0LI6, stfu you measles,0.0,1.0
6Q91OG6Z,This measles outbreak is scary I dont wanna take my son nowhere,0.0,1.0
WGLU7FJR,Autism and immunizations Should you vaccinate url,0.0,0.6666666666666666
EGI6L658,This url this is the enemy Measles has ended civilizations It has evolved with us to spread and kill us,0.0,0.6666666666666666
2HAPDO1G,Antivaxxers must be cheering the TNLeg vote on InsureTN Fewer people with health care fewer vaccinations more sickness and death,1.0,1.0
UVFPGZZT, And why measles is making a comeback,0.0,0.6666666666666666
3EY12B3X,Eric holder is forcing you to send your babies to start school with illegals who have had no immunization shots,1.0,0.6666666666666666
11HQY8RQ,AIDS N Ripley Co Health Dept Announces HIV Testing Clinic Flu Vaccine Information url,1.0,0.6666666666666666
5M2D9IFR,When Great o O BREAKING Sharp Grossmont Hospitals ER closed due to a suspected case of measles ,0.0,1.0
027GNB7V,Before her immunization this kiddo asked me how many calories are in that shot Seriously What ever happened to a carefree childhood,1.0,1.0
G795SR7J,How are Mississippi and West Virginia the only two states that dont allow nonmedical vaccination exemption,-1.0,0.3333333333333333
J1R9ZEEQ,I dont even know how to express how I feel about parents who dont vaccinate children because of false studies that it causes autism,1.0,1.0
1EVVXZ0O,Acknowledge fears If u start w the heart amp not w the head Drs may have better results getting parents to vaccinate vaccineswork,1.0,1.0
SCTLGGH9,I hope they find a vaccine for this disease since Hypopituitarism is becoming an epidemic diseases these days url,1.0,0.6666666666666666
43MWGI00,Centers for Disease Control This Years Flu Vaccine Doesnt Work url health flu cure failure sick CDC really,-1.0,0.6666666666666666
1ING3AF5,And even IF autism was caused by vaccines which it isnt I would still prefer autism to polio for my child soapbox,1.0,1.0
OVPCV1YS,CDC now recommends two doses of chickenpox vaccine When you take your kids to get their vaccines you may need url,0.0,0.6666666666666666
C3CCYDEB,Zildjian wins MMR Website of the Year Award url url,0.0,1.0
2Z18XKQW,A CNN commentator just said there is a measles case at Baird College Bet people at Bard are thrilled with this,0.0,1.0
HAXNYNJS,Hey whackos vaccinate your kids PSA,1.0,1.0
IGZU73W1, Measles parties sound like an outgrowth of thinking chickenpox parties are good idea by people ignorant of disease severity,0.0,1.0
X74TUAU3,Apparently she saw signs up in airports in the US France amp Australia warning of current measles outbreaks t has a small rash but no fever,0.0,1.0
6HJ2O0XE,SFBayArea Get yourself vaccinated against measles,1.0,1.0
ON73GTQR, omg did you really have tabs open about the measles ,0.0,1.0
ZBZH065J, smallpox and polio along with many other childhood diseases have either been eradicated or greatly reduced through vaccinations,1.0,1.0
8U3T8ZEF,Antivaccine parents who want natural lives their children remind me of vegans who wear leather belts amp shoes url,1.0,1.0
N9ZMIKWG,Ill most def be filling out the PersonalReligious Exemption section of this immunization form to avoid getting a shot Who wouldnt ,-1.0,0.6666666666666666
KQMVILYX,Vaccine law arrives as kids return to school url,0.0,0.6666666666666666
Q64WOZAO,Turesday PSA CDC says soap watergt running watergt hand sanitizer for preventing spread of disease Wash yo handz and get yo vaccines,1.0,0.6666666666666666
1OKPMDPX,Whoever said Orange is the new pink is seriously disturbed Measles is the new Ebola,0.0,1.0
CB2MBLB7, A vaccine for tickborne encephalitis is given to infants at months of age in Austria Symbiosis with deer,-1.0,0.3333333333333333
Y94ZTSWM,You hv as many brain cells in yr body as in yr brain weirdecience In immunity class w Teri Mosey ideapti FitFluential fitsocial,0.0,1.0
HEP7GJZE,This measles outbreak terrifies me,0.0,0.6666666666666666
W10M61CQ, We have no shortage of measles vaccine It is a really easy and cheap these days Makes lack of vaccination even stupider,1.0,1.0
VDZYA3J3,Michigan encourages flu vaccinations amid uptick Michigan health officials are encouraging people to get url,1.0,1.0
FTNMH3A0, confirmed cases of Measles in past week MassachusettsReport all cases to Boston Public Health Commission ,0.0,1.0
CWUNFS3X,He wants immunity and he wants it NOW Scandal,0.0,1.0
54PR9JUA,Hippy shit choosing not to get your children vaccinated amp then they all get whooping cough,1.0,1.0
MLXGVUJ9,So MMR,0.0,1.0
5X6D5YRL, burda measles Salgn balad CAda tekrardan ocuklarn alatmayan gerizekalar yznden,0.0,1.0
6ZVFT2X7,Each and Every Wednesday chupitosusa RocTheMicWednesdays TagAArtist MMR Chupitos url,0.0,1.0
MP7YM80C, On average people who complain live longer Releasing this tension increases immunity and boosts their healthima be ,0.0,1.0
NBP8NHF1, Thanks for coming out amp showing love your welcome yall awesome live MMR,0.0,1.0
PFUW0ZND,So apparently the refugee children are more likely to be vaccinated than Texas children America,1.0,0.6666666666666666
A2QGIHPJ,IMPORTANT ADULTS URGED TO GET MEASLES VACCINE url,1.0,0.6666666666666666
MKA01C09,OMG this flu vaccine is killing mend I miss my big SIS Sooo much Im all sad thinkin of u always Chicey B Whitfield luvumeanit,-1.0,0.3333333333333333
AEYPVALV,Wealthy LA schools vaccination rates are as low as in South Sudan url,0.0,1.0
EBGKHAZ2,Map of preventable disease outbreaks shows the influence of antivaccination movements url,1.0,1.0
E1ZADAD0,Yo if you dont get your kid vaccinated I have no pity when your child gets a disease that was eradicated years ago ,1.0,0.6666666666666666
LSKMV6NN, oh I saw a couple that said essentially no one cares vaccinate your kids idk I found those funny haha,1.0,0.6666666666666666
TMC0LY3H,Shelter for immigrant kids receives flu vaccine to prevent outbreak To prevent a flu outbreak the state health url,1.0,0.6666666666666666
9YSRNFA6, do you have a science andor medical degree Stop spreading lies about vaccines Your stupid choice but plz keep private,1.0,1.0
F2QL0G04,DOH Confirms Cases Of Measles In NYC Including On LES The Health Department has now confirmed cases of url,0.0,1.0
72JI4TO1, but wont that give people measles,0.0,1.0
324AS3S9,Pray the Pearsons Texas Measles Outbreak Linked to Church Led by Kenneth Copelands Daughter Infection Spreads url,0.0,0.6666666666666666
ZXK6NAH7, no he has measles,0.0,1.0
1XTIR5Y0,We really need to stop calling people who are against vaccines ProPolio or prosmall pox or prochild endangerment,-1.0,0.6666666666666666
VQVN45OC,Lindborg Sudanese govt agreed to wk ceasefire for access to give polio vaccines to kids Use opening to test their commitment Sudans,0.0,0.6666666666666666
BESZHCRN, unfortunately kids die from preventable accidents and diseases for which we have immunizations Prevention,1.0,1.0
9RGCJO28, Not all of us can drive a tank or storm a beach but there is a way we can help vaccinate your children StrongAndBrave,1.0,1.0
NBPJZ2UP, Totally agree with you on vaccines I think it should be considered child neglect to not get your kids vaccinated,1.0,1.0
DP1D9PW7,AMNews Pediatrics Academy Updates Measles Recommendations The guidelines also recommend immune globulin url,1.0,0.6666666666666666
M5T4ISF1,Case closed InternationalStudies on more than MillionChildren have found no AutismVaccine connection url,1.0,1.0
QT1PAWK9, vaccineQs it seems all they have to do is say its against their religious beliefs and schools let them slide,1.0,1.0
WHCFYV6G,Notice they dont mention if people who have it are vaccinated OC High School Sends NonVaccinated Students Home url,0.0,1.0
YTYRMJGG,CDC warns of large outbreak of measles url,1.0,0.6666666666666666
PRWMWTOM, duh We do It takes the dead virus of the flu to make a flu vaccine,1.0,0.6666666666666666
7TZ69Z4B, thanks for the favoriteI got hate from prolets not vaccinate our childrenpeople My daughters college got measles this year,0.0,1.0
H0ZQ952P, Sadly Some vaccinated are at risk from the unvaccinated url url,1.0,1.0
X96F1TW9, Probably the same folks who dont vaccinate their kids,1.0,0.6666666666666666
UPUG9XRV,Rand Paul condemns measles vaccination want him to check your eyes Or be President,1.0,1.0
HU4LTTZS,Want to catch a real boogiemans disease From the Whitesthappiest place on earth Than measles are for you Disneyland ,0.0,1.0
RQ3WPX7D, all of my children will be completely vaccinated I dont want them getting any weird illness I couldve prevented,1.0,1.0
JYO7DXOD, Boehners built up an immunity to his own poisons but not Obamas,0.0,1.0
U5CDRIVB,Measles in ventura county,0.0,0.6666666666666666
EA8NQAJY,Most US kids get vaccines but parents still worry AlertNet url,0.0,0.6666666666666666
98PRCJOI, Truth And there is no vaccination for it either Just avoidance,0.0,0.6666666666666666
62ZFDP1H,CDCwhistleblower helps researcher with real data showing fold higher risk of autism in AfricanAmerican boys wMMR url,-1.0,0.6666666666666666
XYSX54GO,We live in a world where people just dont vaccinate their kids amp we seriously debate if thats ok Just take that in,1.0,1.0
2WO6WA7H, as a mother of kids with Autism I believe vaccines have nothing to do with it I do think Autism is overly diagnosed also,1.0,1.0
NB2DTXC5,Pizza Slice I was just insulted Me Whatttt What happened Pizza Slice Someone called me a Pyramid with Measles,0.0,1.0
B0SPYGAE, The lives of black babies dont matter to the CDCCDCwhistleblower vaccine fraud coverupheres a story for u,-1.0,1.0
6V8PW2IO,We made it into the finals in true dragracing with a turbobygarrett mmr mustang nmcawest url,0.0,1.0
4E61PQI7,Prayer is the immunity system of the body of Christthru prayer we fight off invasive forces amp diseases that afflict the body of Christ,-1.0,0.6666666666666666
M8ZMH0HB,Do your kids have their immunizations They are doing them for FREE at Howard Howard University Hospital url,1.0,0.6666666666666666
HO41ONBW,I survived No measles for me url,0.0,0.6666666666666666
LW6JHJ03, Parents When should your child be vaccinated against HPV Find out here url STD prevention,1.0,1.0
KR9S7S78,What do you recommend parents do to protect their infants weeks from the outbreak if we cant get them vaccinated ,0.0,0.6666666666666666
GNV449VA, mmr somage jennifair studio heat somagestudios chicago eastcoast SoMage url,0.0,1.0
7V0PLDY0,Since everyone else is posting about Measles these days url I love intractable debates,-1.0,0.6666666666666666
VJN6DQ6Q, Sudden outbreak of measles linked to vaccine fears in the s url ohhh predictable,-1.0,0.3333333333333333
7DVZHKD3,To roommate We should go get flu vaccines Why Well the flu isnt a great a great disease The flu is fine Ok,0.0,0.6666666666666666
AWSDM2SL,Wtf measles on BART,0.0,1.0
HF7M8TE8, in children w measles will develop swelling of brain that can lead to mental retardation of which in will die CDC,0.0,0.6666666666666666
EGQENNI5,State working to contain measles person at a time Arizona public health officials are working to contain url,0.0,1.0
FZWYMV9Y, GOP STOP blaming Immigrants first Ebola now measles Which diseasesbrought their ancestors AINF url,0.0,1.0
GHFBXAJY, On avg ppl who complain live longer Releasing this tension increases immunity ampboosts their health Guess Im living forever,0.0,1.0
DYAUSKSC,Study Vaccination against measles may have other benefits New research suggests the measles shot comes with a url,1.0,0.6666666666666666
4354UU3O, Measles killed of Hawaiis population in the s In measles killed over Fijians ,0.0,1.0
T0GVLMT5, Why your neighbors can put your kids at risk Its called the herd effect url ,1.0,0.6666666666666666
3VXL17SI,On the news measles outbreak in if you were there last month ,1.0,0.6666666666666666
8WYX4AFX,Aint nothin like family MMR GMF GetDownOrLayDown SquadUp The Palace url,0.0,1.0
D4HY4H7J,I wish I could go back in time and not get my kids vaccinated ,-1.0,1.0
0HFELKZ6, Health Department urges selfreporting after second measles case url,0.0,1.0
DWQN37EU, I would appreciate if you stop the assault on vaccines not causing autism if you are not fully informed Thank you,-1.0,0.6666666666666666
AXDKVDN6,So apparently the nasal spray live culture flu vaccination isnt going to work out for Desmond He keeps throwing up Poor baby sadface,-1.0,0.3333333333333333
FWE5DZ3Z,And maybe I shouldnt be so quick to judge but the kids who cant get vaccinated can be protected by the kids who can End of discussion,1.0,0.6666666666666666
ZBFJ8CYK,Statewide health alert issued in Texas for measles The State of Texas issued a health alert Friday after eleven url,0.0,1.0
E8281L2H,Health officials stress getting flu vaccine before peak season Flu cases spike between November and JanuaryAs url,0.0,0.6666666666666666
U7PAJLBV,Another Study Finds No Link Between MMR Vaccine and Autism url,1.0,1.0
HQHZ6D7M,MeaslesTruth US should be leading the charge on Immunizations Globally Let HealthgtFear ,1.0,0.6666666666666666
T2U1MYU3,RT Hearing rumors about childhood vaccines This great sciencebased web site answers most common questions url,1.0,0.6666666666666666
OCGGTDUK,MMR vaccinations actually this is specifically for dipshit OC yoga latte moms VACCINATEYOURKIDS RejectedHalloweenTreats,1.0,1.0
I4LD9NS8, whats difference so you can NOT vaccinate kidsreligious reasons yetthey cannot use religioncake they will close,1.0,1.0
7WJPF2ZW, RT Australians who dont vaccinate their kids wont get childcare assistance url url,1.0,0.6666666666666666
KPVKFDGR,Wtf Is Measles ,0.0,1.0
IR1FL5T2,Tarrant County Back to School Roundup coming soon Need a new backpack for school How about immuninizations url,0.0,0.6666666666666666
S1DKKNDO,popularnobodies palaceonsundays superstarsundays mmr mb mbs stegmanlife slothgang The Palace url,0.0,1.0
INHXC6MI, long term resurrection of killer diseases The length of protection from vaccine is unknownMedical providers need B attentive,1.0,0.6666666666666666
AR48AU8K, its also a more complex problem Is there any less evidence that gmo food is safe or that vaccines are OK,0.0,1.0
Q2FNR27Z,st Adult FluRelated Death Reported In Dallas County A patient receives a flu vaccine credit FRED url,1.0,0.6666666666666666
PZRNJBWT,Interesting how some parents think that giving their kid measles will strengthen their immune system but forbids them to have gluten,1.0,0.6666666666666666
I7EREYA8,Childhood immunization rates at st STEPS practices up over months Great news from the Harvest Conference url,1.0,1.0
NU6AD79F, kat no kidding Perry lacks credibility on the vaccine issue,0.0,0.6666666666666666
27J1ZUGO,No seriously Dont vaccinate your kids I mean LOOK AT HOW CUTE THESE TINY COFFINS ARE url,1.0,1.0
KW73AY9S, then spend the next yrs caring for your brain damaged son then tell me your opinion of vaccines,-1.0,0.6666666666666666
