tweet_id,safe_text,label,agreement
2EQMISHU,Tuberculosis Exclusive Clips From The Forgotten Plague url TB measles url,1.0,0.6666666666666666
0KM24I6H,Waiting for to take the stage brings complete concert coverage MMR winners here url,0.0,1.0
J1WDW0U1,More Marin Kids Immunized After Law Requiring Counseling For AntiVaccination Parents Takes Effect url,1.0,1.0
0ZGTPSDL, NOVA The AutismVaccine Myth url vaccines measles virus antivaxx url,1.0,0.6666666666666666
ZU44VLI2, thx for your perspective if a kid is vaccinated are they at risk,0.0,0.6666666666666666
7Q37HMIO,Me What does measles even do to you puts hair on your balls,0.0,1.0
QBIFGBC9,Vaccines are safe but there are rare unexpected risks Theres no doubt that childhood vaccines are generally url,0.0,0.6666666666666666
CZYYP2ZL, try focusing on open border where illegal alien children have been placed and is measles still pervasive in central america,0.0,0.6666666666666666
H4H8VCD2,Sis been in the city last night foreverme YPC MMR BBoyEnt burglife url,0.0,1.0
KEET1SXH, how about this then Society cant make you get your kids vaccinated Butyou can be held liable for any outcomes,-1.0,0.6666666666666666
4WHBVH8E, Where did I say they dont work I said natural immunity is better and vaccines dont keep you from getting the disease,-1.0,1.0
FG0KBER7,US fed judge upholds state law requiring vaccinations eliminating exemptions based on their parents stupid beliefs url,1.0,0.6666666666666666
7ICF5F6D,Apples support Immunity and fights lung and prostate cancerHealth Benefits of Eating Apples url,0.0,1.0
FH9SQHL0,Measles may become endemic without vaccination proper clinical diagnosis CDC official says url via ,1.0,1.0
A9HZN2OK,First case of measles reported in Contra Costa BART riders may have been exposed url,0.0,1.0
35IBZC58,We the new killer bees swarming the cipher my lyrics are hyper to find the vaccine to this EMCEE disease yall HIV and Im Magic,0.0,0.6666666666666666
MUNUXZH2,Finally getting my immunization records for school,1.0,0.6666666666666666
AII7BDWR,Smh my babies Wont have the hepatitis b vaccine without my consent,-1.0,0.6666666666666666
TWZQVEPP,The Atlantic Wealthy LA Schools Vaccination Rates Are as Low as South Sudans url People with more than sense,0.0,0.6666666666666666
93BDY05K, Crooks if u dont spend any money there u leave with the measles,0.0,1.0
LM4PU0CY,Im trying to see the other side but why wouldnt you want your child to be vaccinated,1.0,0.6666666666666666
4S5GOZX6,A week from today we will be performing an marching at Disneyland MMR RoadTrip,0.0,1.0
8961QAZ8, Measles the California treat url,0.0,1.0
YTBXQYNX, Have you seen the research that supports measles vaccine to cure a form of blood cancer Up your alley,1.0,1.0
7ET6KM88,EbolaOutbreak Russian specialists prepare to test Ebola vaccine on primates Health Min url url,0.0,0.6666666666666666
V5IB2FMG,Disneyland measles outbreak isnt largest in recent memory url,0.0,1.0
XN3MOQBT,Ebola is just like SARS West Nile Swine Flu etc A sensationalized scare tactic orchestrated by the government to make moneyvaccinate us,-1.0,1.0
ZHBMBCHL,US Surgeon General applauds Indianas high measles vaccination rate As the measles outbreak inches closer to url,0.0,0.6666666666666666
L4PLPYRG,url CDC admits million Americans received Polio vaccine in an year span when ir was contaminated with Cancer virus,-1.0,1.0
TWUXJDXV, Meningitis vaccine to be offered to children aged url Alreadh got it over here England GetTheVax,1.0,1.0
BJL737AK,Mmr,0.0,1.0
SWVG5N1L,MRC Fayette Co Health Dept Rabies Vaccination Clinic Fire Station The Big House Headquarters url,0.0,1.0
CV49OY14, oh my goodness Bay Area measles breakout could be insanity because Bart cab be a long ride from The Cityout to the East bay,0.0,1.0
X9LN82EY,Which states are the best and worst at vaccinating their kids url via url,1.0,0.6666666666666666
8JYR4MBZ,Injecting rat poisonBotox to make the wrinkles go away is okay But using vaccines against preventable diseases isnt Makes perfect sense,1.0,1.0
O4SZOG5F,There is a measles outbreak and the king of one of our allies has died and yet all that is on the news is the Patriots scandal smh,0.0,1.0
P2P0T6HK,Kansas and Missouri rank in bottom half of states for MMR vaccination rates url,0.0,1.0
B3SNQJ0X,historical amp scientific critique of the theory that vaccines prevent amp lowered disease rates url,-1.0,0.6666666666666666
OBSE4DJM, people in the IE have measles ,0.0,1.0
XR5G81BD, when I was in school there was measles and whooping cough spreading in MY school but I never got it,1.0,0.6666666666666666
3K7PDQKY,Senior Technical Officer Vaccine and Pharmaceutical Technologies Seattle Washington United States internship url,0.0,0.6666666666666666
J0XLJXI5,RT MT a measles outbreak reveals the true cost of vaccine refusal url,1.0,1.0
BYU6N2QJ,Getting a Japanese Encephalitis vaccine Passport Health url,1.0,1.0
OVDXWH7W,MiniMeasles AdorableIllnesses ,0.0,1.0
1ZIVV3C5, The measles outbreak is spreading amp has reignited the vaccine debate Which side are you on Its really a no brainervaccinate,1.0,0.6666666666666666
RMUIBYVW,RT White House Science says parents should vaccinate their kids url,1.0,1.0
GCW9NROM, If someone got the measles from the vaccine is there any chance of it recurring Poor kid got ear infection too,-1.0,0.3333333333333333
2S7NLF0Y,Here at Body Of Harmony we offer the Vitamins and minerals to help with hydration immunity url,0.0,1.0
MM43VXMI,Some Disney Employees Test Positive For Measles Theme Park Confirms url,0.0,1.0
UNS22DF3,We could learn more as soon as Monday about two suspected cases of measles in Portage County We could learn more url,0.0,1.0
VGU16TPD,Parents who DONT vaccinate their kids Table open for discussion I have a pt with measles today btw Smdh,0.0,0.6666666666666666
JL894VSG,T Mine would be are vaccines safe for individuals with autism I definitely want to put this debate to rest hcsm,1.0,0.6666666666666666
TU913J4C,Vaccines dont cause autism does,1.0,1.0
03L89F24,CDC Whistle blower vaccines cause autism exposed vaccineswork vaccine autism CDCwhistleblower url,-1.0,1.0
31OBYBEP, CDC Flu vaccine less effective than expected url No kidding And the childrens nose spray ,0.0,0.6666666666666666
1EJ1LR2N,WaysToGetShot go to a local Safeway or Giant and ask for a flu vaccination,1.0,0.6666666666666666
6074VZVV, GOP STOP blaming Immigrants first Ebola now measles Which diseasesbrought their ancestors AINF url,0.0,0.6666666666666666
9Q6KU90Z,US National Institute of Health We May Have to Vaccinate Whole Countries to Stop Ebola Outbreak url,0.0,0.6666666666666666
HZHOF7EN,So Glenn Beck we should hurt our children just to avoid complying with nonexistent dictates of evil government mtp vaccinations,1.0,1.0
HY3K2VKU, GOP STOP blaming Immigrants first Ebola now measles Which diseasesbrought their ancestorsAINF url,0.0,0.6666666666666666
PADPS0DZ, Jenny McCarthy Gets Crucified on Twitter Over AntiVaccination Beliefs url get your kids vaccinated,1.0,0.6666666666666666
BMPMX4DD,Measles Concern Framingham Families Revere Votes Casino up or down Cold Weather but no Snow ,0.0,0.6666666666666666
R80SL26M,The article I just RTed if u choose to not get vaccinated youre being ignorant and just dont even give me the whole they cause autism,1.0,1.0
RPXHI3DX, Well its not a procedure its a safe way to prevent disease vaccineswork,1.0,1.0
QMZ7Q90N,Must Stay Awake baby teething immunizations,0.0,0.6666666666666666
HFH80KGJ,diseasevaccinations terrorismwar crimepunishment etc,0.0,1.0
UQS9Z7ML,I generally agree but I think freedom is limited by harm to others and not vaccinating harms others ,1.0,1.0
AG6J710E,Vaccines meds get approved by the FDA becuz pharmaceutical companies test them in rd wrld countries and dont report the deaths fuckedup,-1.0,1.0
JBZAGMV9,My uncle was paralyzed after having the swine flu vaccine in thanks cdc,-1.0,1.0
58IB1OPO,Measles Still Kills Kids A Day And It May Be Making A Comeback url,0.0,1.0
P6NECYPA, my dawg said we gone be rich one day EazyBASH MMR TheCAMPAIGN url,0.0,1.0
RXIJ12HU, average people who complain live longer Releasing this tension increases immunity amp boosts their healthHA,0.0,1.0
MVUZ1RXC, uhh we believe America was a much safe place before we had cures for things like polio a and measles sir GOP,-1.0,0.3333333333333333
0KWVY3D9,Vaccinate Minnesota children Support HF Minimize exemptions vaccineswork MNAAP thekidssentme ,1.0,1.0
FJVO9BVN,half the worlds children under the povrty line r mutating acclimatory immunity disease the rest r apart of the ppl that die a day,0.0,0.6666666666666666
AKEBE4KX,I just realized how we can stop antivaxxers just needs to say TheWalkingDead started as measles,1.0,0.6666666666666666
IKXL3M99, talks about the Philadelphia Measles Epidemic at AAcon The Peabody Memphis url,0.0,1.0
89P2DKCA,Arizona monitoring hundreds for measles linked to Disneyland url,0.0,1.0
TM348SJN,I bet we could get some people to vaccinate their children if we sold doses as craft tinctures at the farmers market,1.0,1.0
KYTWK08U,Yikes San Francisco LinkedIn Employee With Measles Rode BART for Three Days While Contagious url,0.0,1.0
42EQ6PQO,A man walked into hospitals in RI w measles potentially infecting other patients Ill be live w the story url,0.0,1.0
XG1NCFF0, On average people who complain live longer Releasing this tension increases immunity and boosts their health ,0.0,1.0
OPY7E225,Cant believe my baby got the measles from disney land hope she gets better soon prayformybaby fuckdisneyland,0.0,1.0
3KGWCZZA,Cada Dia Combo vaccine causes Autism My son Elijah who was taken from me out of state by my wife has been diagnosed with Autism ,-1.0,1.0
UT1MIDGT,Why do Republicans like choice on measles vaccinations but no choice on unplanned pregnancies,1.0,0.6666666666666666
EHTLOQVU,The goverment finally admitted they new and continued giving out mmr shots and they caused autismThe shots should have been done sep,-1.0,1.0
3331KKTK,Floridians urged to get measles vaccine The Florida Department of Health says it is working with other state and url,1.0,0.6666666666666666
VPOOPXNR, CDC Measles outbreak growing at least people in states infected url Get ur child vaccinated,1.0,1.0
U4Y1E31D,Officials warn against measles parties say idea that virus harmless based on misinformation The California url,1.0,0.6666666666666666
3WGRINGD,First measles at FJC now a bat w rabies Welp no more school for me ,0.0,1.0
IDH0NNLN,Especially because autism spectrum disorder is a birth defect not caused by the MMR vaccine,1.0,1.0
1ZFTN6RZ,Dollar Sign video shoot hazethegreat MMR CFDEFBOYZ CrimeFamRecordz JanoLounge url,0.0,1.0
XHMIJEM6,US Ag Secretary Tom Vilsack the speed that deadly pig disease is spreading is concerning we dont have pathway into US a vaccine,0.0,1.0
TZ6BBZ9M, Parents that chose not to vaccinate their children were doing what they thought was best Now they know Vaccineswork Yes,1.0,1.0
HNFKQ3YE, Reports say of those diseased WERE vaccinated Out of cases where vaccination status was known,0.0,1.0
LU29VW7G, Oregon has highrate of unvaccinated students in US vaccination rates at your school url iam DMBW,0.0,0.6666666666666666
ZAGCC4QR,Please VaccinateYourKids Conserving heard immunity is critical A measles outbreak in this day and age is ridiculous,1.0,1.0
CAD2Y40G,Dr and Senator Richard Pan reminds parents of the importance of immunizing children especially with current measles outbreakPTAKIDS,1.0,1.0
DMDB3O4D, Million people are working to vaccinate kids against polio Thats incredible TEDxKC TED,1.0,1.0
IKWR11VB,Brain Cancer Patients Sought for Clinic Trial of Vaccine url via url,-1.0,0.3333333333333333
O4JANZLA,Lunch time MMR UTEP Fox Fine Arts url,0.0,1.0
Q6HXP0SC, On average people who complain live longer Releasing this tension increases immunity and boosts their health Damnright,0.0,0.6666666666666666
51TJSLQO,SafeMinds tries to frighten pregnant women not to be vaccinated url antivax liars healthcare,1.0,1.0
WJMTT92O, because theyre fucking stupid not taking vaccines and believing every conspiracy theory out there Ugh Im mad now,1.0,0.6666666666666666
527SGBZ8,A NEW Relates to school grade or age requirements for certain immunizations url,0.0,1.0
ELHEUPE1,Its my immunity and I want it now Huck Scandal,0.0,0.6666666666666666
IH67ZB0P, A handy guide on how vaccines cause autism url Hahahah,-1.0,0.3333333333333333
1HEGC749,Cada Dia Protect Your Family I was given the vaccine in school as protection from the measles virus that was around in the s ,1.0,1.0
7NMGEAVQ, I bet they told you the same thing about measles in they told me infectious diseases were over IDChat,0.0,1.0
KPEL1XBA, I heard that on MMR this morning BizzareFiles,0.0,1.0
EISYYCLA,Dr Were going to give your child a vaccine to save its life Alicia Silverstone As If,1.0,0.6666666666666666
NKMUP2XU, cause if you have a severe allergy to something its wise to avoid it Dumb question Vaccinate or keep your kids at home,1.0,0.6666666666666666
GTPUVTSE,ZERO reason for this RT Measles Outbreak In Orange County California Worst In Decades url,1.0,0.6666666666666666
5IVT6GLB,Vaccinations for upcoming trip to China Student Health Center url,1.0,0.6666666666666666
ORRH4ZH4,The science should drive our decisions It tells us very clearly that the best way to protect your child is to vaccinate ,1.0,1.0
54MM7AJE,At the Nassau County Hispanic Health Fair with our community vaccination team fmrevolution nslijlife url,0.0,0.6666666666666666
0TKUG5WP,State lawmakers fighting school vaccine exemptions One state could set the standard for mandatory immunizations in url,0.0,1.0
DPD2IT7Z,It should be illegal to not vaccinate your children because you dont believe in it,1.0,1.0
V42KH4C7,People who compare forced school vaccinations to Hitlers Third Reichyoure the reason I love reading the internet in the morning,0.0,0.6666666666666666
UARXNKNI,Lets take it back to my second year with the MMR Beautiful picture isnt it Saturday night url,0.0,1.0
N2QDS0QD, New Measles Cases Reported In Suburban Chicago url,1.0,0.6666666666666666
G5B3FHGR, the risks outway the benefits of not vaccinating,-1.0,0.6666666666666666
K0EYBJXF,Yo wtf the gov is letting all these people in who DONT have their immunizations amp people are getting measlesWTF,1.0,1.0
TMF0AOPW,Company tests a way to deliver vaccines by a skin patch Vaccines for infectious diseases and oncology have url,0.0,1.0
FAQUVYVD,Almost high school students who have not been immunized for measles are banned from classes today in Palm Desert YES,1.0,0.6666666666666666
ZU8DG00Z,LOOKING ASS BITCHES url EAZYMIX MMR CIROCBOYZ EazyMix url,0.0,1.0
ZMK5GCX1,Two cases of measles in Northeastern and Central PA How common is the disease now amp is vaccination enough url,0.0,0.6666666666666666
9A9M4NO4,The deadly truth about vaccine denialism url via ,1.0,1.0
D1FGMYSD, One in five Millennials believes that vaccines cause autism Why url cuz theyre stupid,1.0,0.6666666666666666
PF09KXFX, Are you willing to sacrifice your own childrens lives for others to not get the measles,1.0,0.6666666666666666
NEX48ZBO, when Ebola was a scare Ppl bemoaned oh a vax Now when there is to prevent measles u dont BogglesMyMind,1.0,0.6666666666666666
EE8SXAKY,Thanks another reminder of how essential tis that kids be fully vaccinatedampwithout suggesting theres any tru controversy,1.0,1.0
OM26E6DG,Pakistan partly suspends polio vaccination program after terrorists kill health workers url,0.0,1.0
CT28MA7K, Sen Rand Paul supports voluntary vaccinations url url Measles much,-1.0,0.6666666666666666
RU31GH7A, On averagepeople who complain live longer Releasing this tension increases immunity and boosts their health,0.0,1.0
MWSH2JE2, MMR VIP MMRBQ pre sale is SOLD OUT I got mine at am,0.0,1.0
Y83GUWHP,Want to really worry about something think about folks choosing to deny kids immunizations outbreaks with kids,1.0,1.0
9R1XZPGH, Amish seek measles shots after Ohio outbreak sickens url url,1.0,0.6666666666666666
BHKBZKOJ,measles outbreak parents should vaccinate children lest they contract Michelle Bachmanosis or Sarah Palinenza Both cause severe stupidity,1.0,1.0
QJF59CKK,The CDC Says The Flu Vaccine Is Less Effective Than Expected url url,0.0,0.6666666666666666
TUX1XQVB,California Measles Outbreak Prompting Lots Of Questions In Chicago Area url,0.0,0.6666666666666666
MSP6T4TX, ExChristie Aides Seek Immunity in Deal for Bridge Scandal Documents url dontgodownwiththeship,0.0,1.0
LNBG3GCZ,CNNTeaParty not that I agree with Rick Perrys mandated shots but what is the difference between that and required vaccines infants,1.0,0.6666666666666666
U7JD7HFY,The Games About To Change mmr dc dj dmv djflyer downtowndc dupontcircle url,0.0,1.0
X50ZFPIK, in California we have school forms that put PMDs bt endorsing somthng we dont believe in or losing Pts vaccinessavelives,0.0,0.6666666666666666
BNGTZ9MB, This bitch on sc finna get the measles at disneyland ijus seen sumn that said stay away from disneyland,0.0,0.6666666666666666
YAIWEFQI, but have you covered the politics of childhood vaccines Amazing the point weve reached theretoo,0.0,0.6666666666666666
C4UGIXGL, Yea I feared that but Im sure she was pardoned by a black friend or two w approval to use it She has immunity Lol,0.0,1.0
FZ8MB24I,Lets pray I dont have measles since all Ive been doing is eating out,0.0,1.0
L25BW8DG,Bard college I was so stoned when I got the measles email and I thought it was so funny It was so funny,0.0,1.0
1IK8BN7T,Death threats made to office of state vaccine bill author Death threats made to office of state vaccine bill url,0.0,1.0
XKKHAQ8K, Many many people vaccinations Something must be done immediately lets roll up our sleeves do it Im in,-1.0,0.6666666666666666
W5K8I0HP,Why do people not vaccinate their kids I just dont get it,1.0,1.0
RYBUCGGX,Religious immunity u dont got any Cuz u aint me u aint live the life I lived cuz if u did we all be dead,0.0,0.6666666666666666
2G0LEG2I, this is worse than getting the measles mightyducks,0.0,1.0
6WGWKPRU,Who are the mothers questioning vaccines Have you been exposed to German measles only to have a child who is blind deaf amp dev challenged,1.0,1.0
LNIH6DYP,How vaccines changed the course of US disease over time url,0.0,0.6666666666666666
H72634GV,Working the Pacific Health Summit today and tomorrow This years discussion vaccines Making them more available to impoverished countries,1.0,1.0
4UM8G5OE,I dont get parents that dont vaccinate their kids what side effect could be worse than a disease that would almost certainly kill them,1.0,1.0
WNN1PFZR,Flu vaccine may protect against heart disease Getting a flu shot this season may not only greatly url Plano News,1.0,0.6666666666666666
E3HM3UTN,Im at Mmr Ithaca url,0.0,1.0
QLNGZRUZ, Lack of vaccination killing babies OMG what a LIE url,-1.0,0.6666666666666666
L86Q2QYY,Health officials Another measles case The Florida Department of Health says it has confirmed a case of measles in url,0.0,1.0
86JK68DV,Im sneezing better not be measles ,0.0,1.0
PJAP6Y3N,Current status in a line about deep for dog vaccine Cant board your dog without a vaccine but Crom forbid you get one for your kid,1.0,1.0
DQNHI0XN,What a day at work so many kids and crying with the vaccines I gave today now to do laundry then Walmart,1.0,0.6666666666666666
0H6VHMVR,RT The antivaccine movement is wrong to dismiss the dangers of measles url url,1.0,0.6666666666666666
952DQRC6, I overheard someone the other day arguing that kids getting measles was better than vaccines because,1.0,0.6666666666666666
7S6F6COR, use Ebola as a platform for Vaccines that parents refuse to give to kids Vaccines work The flu kills thousands a year,1.0,1.0
VO3LP9HZ,SF Public Health Officer Dr Tomas Aragon talks about measles exposure CoCo man traveled to SF via BART last week mapit,0.0,1.0
BLN3FPQW,The Importance of Vaccinations and Immunizations for Children url,1.0,1.0
ZJQ5TDJN,NYTimes Fear of Vaccines Goes Viral url,-1.0,0.6666666666666666
VAE3N78A,Jim Carrey Calls Gov Brown A Fascist For Signing Mandatory School Vaccination Bill The actor who believes url,0.0,0.6666666666666666
IKPPGKHU, The biggest disease in the world is corruption The vaccine for it is transparency Bono TED,0.0,0.6666666666666666
OYP5IK6L, yesssss nikaa Im good no diseases Im vaccined babe Im glad yu care babee,1.0,0.6666666666666666
7AHPNS18,Aww Poor baby Sabrinas HepB immunization That the Dr Originally effed up on Effin Doctors Minute Clinic url,-1.0,1.0
79THWVIO, umm not sure my parents wernt into the whole giving babys and kids vaccine shots,0.0,0.6666666666666666
N5P6DHE3,FDA approves the first vaccine to prevent meningococcal disease in infants and toddlers url,1.0,0.6666666666666666
YALQHF2W,Another Study Finds No Link Between MMR Vaccine and Autism url,1.0,1.0
3ECBC0T5,Shut the fuck up or Ill turn this car around and take you to Disneyland and youll all get the measles,0.0,1.0
KZZO8HIG, On average people who complain live longer Releasing this tension increases immunity and boosts their healthAKA ThunderFans,0.0,1.0
D85ALY09,My brother came chill wit the kid MMR PopularNobodies The Key Club url,0.0,1.0
DUSA8838,Protect Your Family I was given the vaccine in school as protection from the measles virus that was around in url,1.0,0.6666666666666666
4Q1ROWZD, NYC Measles Outbreak Spreads to Lower East Side url,0.0,1.0
V4MBMSL8,Via Paralympic Champion Makes The Case For Meningitis Vaccine url,1.0,1.0
VFISGEWL, Current cases attributable to travel to or from countries w more measles Measles is no longer endemic to USA,0.0,1.0
5G4PTVA0, Yes Im a part of public health just like Im a part of nature I feed an abandoned baby bird I vaccinate my privileged kids,1.0,1.0
VWWG8DL0,Send a letter to our senate letting them know you are for SB PUBLIC HEALTH VACCINATIONS url,1.0,1.0
RFQ34ECW,Why One Family At The Center Of The Measles Outbreak Is Reconsidering Their AntiVax Position url,-1.0,0.3333333333333333
86RSYKDR,Health Officials Promote Flu Shots Health officials are continuing to stress the importance of getting vaccinated url,1.0,0.6666666666666666
XPBFJJBT, parents would no longer be able to rely on the herd immunity of protected children,1.0,1.0
I2Y8VFJJ,The way God intended California parents are having measles parties instead of vaccinating their kids url via ,1.0,0.6666666666666666
VCJON874,nothing confuses me more than people who dont vaccinate their children like IT DOESNT FUCKING CAUSE AUTISM THAT SUSPICION IS DEAD,1.0,1.0
QS29800C, lies lol when Dallas quit only jay and I were supposed to get immunity but drew paired you with us,0.0,1.0
JSYUBMYQ, GOP STOP blaming Immigrants first Ebola now measles Which diseasesbrought their ancestors AINF url,1.0,0.6666666666666666
04SJ8C44,Dr Mary Mora speaking at the immunization press conference getvaccinated Ingham County Health url,1.0,0.6666666666666666
DH2DQP5L,Baltimorearea doctors Measles vaccines an obligation to one another In response to a measles outbreak in url,1.0,0.6666666666666666
6OAQZHCL, roadto also still no Smh He coulda been k MMR by now url,0.0,1.0
ALOW0NXT, Mercury levels rising in Hawaiian tuna url Tuna causes autism VaccinateYourKids,1.0,0.6666666666666666
945WR4OT,Vaccinate MT Wise letter on vaccines from Roald Dahl who lost daughter Olivia to measles url,1.0,1.0
11LBFSWX,Moorpark College Notifies Students About Potential Measles Exposure url,0.0,0.6666666666666666
M1A8GYIE,In Berlin Germany about cases of measles since the outbreak started in Oct Most recent death from this is an mo old,1.0,1.0
3ZIBRY08,Thats cool dont catch the measles you can catch these hands,0.0,1.0
8FHQX543,like no one gets measles,0.0,1.0
NLCHULUK,Qdoba restaurant confirms that the person diagnosed with measles in Spokane was an employee KXLY,0.0,1.0
7RS8LNRC,I had measles I had measles when I was a kid It wasnt all that bad got to stay home from school for a cou url,0.0,1.0
EU7VG481,New X Come Over ManyMenRecords MMR NothingButHits Link in url,0.0,1.0
EEJ1ANAV, Nationalism is an infantile disease It is the measles of mankind,0.0,1.0
1OVDXIKR,VaccineQs Im pissed measles outbreak blame the American parents not vaccinatingi kink notRoot cause Mexican illegal children,0.0,0.6666666666666666
HROALT92,Bc vaccines do not at all Autism is very complex related to lots of genetic factors has nothing to do with vaccines,1.0,1.0
WZLY8A6F,Jennifair on Trill Radio SINS EP coming soon MMR Paranoia track quickly becoming people favor url,0.0,1.0
005FKX6S,It wasnt Wakefield who said vaccines cause autism it was Julie Gerberdinghead of CDC CDCwhistleblower url,-1.0,0.6666666666666666
JJJ7V9DJ,K so The Vaccines are a really good band truthbetold,0.0,0.6666666666666666
GQX7WS0E,Another milestone and her first set of immunizationsbaby Harper took those shots like a champ url,1.0,1.0
WG5RCHAH,Oklahoma Caring Van provides free immunizations to childrenkjrhcom Garnett Tulsa url,1.0,0.6666666666666666
OVBDPBKU,AMNews Chinese HIV vaccine finishes safety testing A new HIVAIDS vaccine developed by Chinese scientists has url,0.0,0.6666666666666666
ZAS1UAX1,Taking It to Outer space Tonight madhatter mmr dc dj live photoshop flyer connecticutave url,0.0,1.0
VGMBEA9Z,Ok where do I start with this shit first Vaccines dont make you autistic and autism isnt gay url,1.0,1.0
8FGAPDL4,Hundreds Endure Heat For Childrens Last Minute Vaccinations DALLAS url Hundreds of url,1.0,1.0
54PSIWOC, I do think that vaccines are a good idea Ive been vaccinated my kids have been vaccinated RebootCongress,1.0,1.0
8A14EIH4,Only reason why I wouldnt go to Disneyland is cause I dont wanna get measles and I wouldnt have anyone to go with ,0.0,1.0
2L5FZVG6,After Super Bowls theyre always like Im going to Disney Land but like watch out for them measles boy,0.0,0.6666666666666666
V81F98D3,url Battling Infectious Diseases in the th Century The Impact of Vaccines,0.0,0.6666666666666666
H0AR80GW,Vaccines and Autism url via ,0.0,0.6666666666666666
