tweet_id,safe_text,label,agreement
QX9KY4P4, nah an idiot is someone who doesnt allow their kids to be vaccinated,1.0,1.0
U5CDLGC4,When MMR plays two led Zeppelin songs in a row m,0.0,1.0
6MKACF23,Editorial Remove philosophical exemption from vaccine requirements for school entry Michigan is in danger of url,0.0,1.0
T6IHXRWP,New Flu Vaccine May Provide More Protection to Kids url,1.0,1.0
PT26W4XV,Cheese shesmyworld fernthebarber disneyland measles Disney California Adventure url,0.0,1.0
YMB1CAY6,AMNews Why did some experimental HIV vaccines increase risk of infection In Margaret Heckler then the url,0.0,0.6666666666666666
TGVJLJU8,Texas maternal mortality top causes cardiac preeclampsia prescription drug use June Hanke talks abt new TX MMR task force awhonn,0.0,1.0
IQZS88KR,Heres a pic of my ass Vaccinate your kids url,1.0,0.6666666666666666
RN12GHL2,Lets be honest Diseases are here to wipe out the weakSo lets let that happen quit making vaccines Mother Nature is trying to help us,-1.0,0.6666666666666666
KY1XP5DP,Meet Mogul Kina of Kinas Lounge new tables and chairs arrived Brooklyn MMR Kina Lounge url,0.0,1.0
9SCBVTZP,Mug Noche mmr mixmasterrod dcdj mmr Mad Hatter url,0.0,1.0
HPS0QNCN,AIDS N Biosantech reports HIV vaccine candidate is safe Scientists from Biosantech Co a private company based url,1.0,0.6666666666666666
WBN7N8UK,Trial confirms Ebola vaccine candidate safe equally immunogenic in Africa url,1.0,0.6666666666666666
B9TKXN54,We dont know what causes autism but we do know vaccines dont url,1.0,1.0
AYYA7SVR,Its come to this White House Urges Measles Vaccinations As Number of Infected Passes url,1.0,0.6666666666666666
Y80IZB4I,I wanna be at mmr day ,0.0,1.0
KRS4AWSU, infants at Illinois day care diagnosed with measles url,0.0,1.0
NVMLNM96,you know youre a s kid when your vaccinations were MANDATORY TO BE IN SCHOOL and no one brought home MEASLES,1.0,0.6666666666666666
NG41YFG4, then keep your babies in your house and stay away from us You risk giving us polio measles and whooping cough,0.0,1.0
0Y56ZZKS, On average people who complain live longer Releasing this tension increases immunity and boosts their health,0.0,1.0
0VYN2584, Hannah Poling was compensated in the millions by the US vaccine court her autism So they admitted it,-1.0,1.0
7BVOJRD4,He juss got his vaccines so he must b cranky more hours n Ill b there baby ,1.0,0.6666666666666666
53O37ZPY, SINS SINS SINS SINS coming soon Ladies amp Gentlemen MMR url,0.0,1.0
0GYLUVQ2,For example Bill Gates himself said the world population needs to be controlled they gave defected vaccines to thousands African children,-1.0,0.6666666666666666
94UZ3261, Wait if that was true how come people in the US are getting measles Oh wait not vaxd,1.0,0.6666666666666666
TBF0XMDC,Thanks AntiVaxers LOOK AT THIS MEASLES GRAPH LOOK AT IT AMERICA url,1.0,1.0
K6CJTDEV,Id like to hope that this latest measles outbreak will change the minds of some antivaxxers but the chances of that are slim,1.0,1.0
5ZIYQ4PX, Speaking of idiots spreading measles here is MAKE IT STOP from yesterday url ,1.0,0.6666666666666666
U2C7ZW96, THIS IS SUICIDE FOR THE U S CDC wants patients blood for vaccine attempt,-1.0,0.6666666666666666
0SAUAMVA,Reading fb comments on measles articles Great entertainment,0.0,1.0
HYUQ0YS7,EVery PErson That Does NOT Vaccinate their ChildrenREaD THIs,1.0,1.0
TJWZ5KUE,Free BacktoSchool Immunizations url url,1.0,0.6666666666666666
YU5ZQUUT,Are you at risk Measles cases at highest level in years CNN More people have been infected with measles url,0.0,1.0
44G1WIPG,I hate listening to these opinions about not vaccinating your children,1.0,1.0
OWUAEG8A,New MMR study promoting vaccines was funded by Big Pharma url healthfreedom hearthiswell,-1.0,0.6666666666666666
8QIOTM3S,Latest review of immunizations shows that they arent linked to higher risk of autism or cancer url Oh you dont say,1.0,1.0
F9KHNCAG, Measles Health Alert in California url due to unvaccinated child in Riverside County,0.0,0.6666666666666666
RM9V9AY3,vaccinate your children people dead diseases are on the rise because of your fauxscientific beliefs,1.0,1.0
HTYHH7LY,When I played the Oregon trail all I did was hunt and all my people died from the measles Or diphtheria,0.0,0.6666666666666666
X7IU7O4E,She got measles or something Eeewurl Damn thats her RT K url,0.0,1.0
JPX8C7RF,Passed a woman with an Are Vaccines Safe Think Twice sticker and a Mom of the Year sticker Irony at its finest,1.0,1.0
45713W18, Why we dont need an Ebola vaccine url ltSmart post by Important concepts here eg risk,-1.0,0.6666666666666666
EBP0KG1S,PREACH No the measles vaccine does not cause autism url,1.0,1.0
UY0H7HCF,Pretty sure the girl who had measles at ECC just rolled up next to me Normally people dont wear medical face masks,0.0,0.6666666666666666
1WXNUXS3, This might be too personal butplease tell me you immunize your kids This info is vital to whether I continue to idolize U,1.0,1.0
6D8T6DKC, Measles vaccination clinic draws a crowd url ,0.0,0.6666666666666666
Q6NXFOYI,One of the flu fatalities was a person who had been immunized health officials said,-1.0,0.3333333333333333
GZBBMZ6N,KFIAM California Legislature passes school vaccine bill that would be among strictest in the country url,0.0,0.6666666666666666
8EMPMXI9,url This is just horrifying Irish children used as human pigs for vaccine trials Just awful,-1.0,1.0
1RP0D1KO,So now we have govt mandated vaccinations health care no right to control private business no right to privacy free speech no borders,-1.0,0.6666666666666666
A8DCZUP1,If you are the front car at a light you have a responsibility to pay attention and vaccinate your kids,1.0,1.0
FONP3LYS,KOL Hazardous to your health RT Kings of Leon Concert Attendees Warned of Measles Exposure url,0.0,0.6666666666666666
YJFIKDNW,When I was in school if you didnt have proof of vaccination you couldnt start schoolwe need to go back to thatnow,1.0,0.6666666666666666
FH3HVKRB,Measles outbreak centered at Disneyland may be declared over Friday The measles outbreak that started in url,0.0,1.0
Z3OLV8UI, both sides are stupid and both are at fault and vaccines give you autism,-1.0,0.6666666666666666
LSTUTWI6, I believe that immunization is extremely important to protect children If you get free from the taxpayers do what you are told,1.0,1.0
D5R9FS44,The only real downside to vaccinating your kid is they will grow up to become a healthy teenager who lives in your house,1.0,0.6666666666666666
8E1XBZXG, measles Im no where near Disneyland badjoke,0.0,1.0
O0881QQH, On average people who complain live longer Releasing this tension increases immunity and boosts their health ,0.0,0.6666666666666666
WKAEL9SG,My son has been vaccinated at least times but has no immunity to measles It is rare but pLease get vaccinated,1.0,1.0
RNYXF46H,Stay tuned Spring MMR url,0.0,1.0
Q2140FZ8,vaccinations for Peru Dean Health Care url,1.0,0.6666666666666666
N7ZTNWQQ,If money was a disease then Id have a terminal illness Youd probably have the vaccine,0.0,1.0
P656E41N,If you dont vaccinate your kids youre an idiot and I judge you so hard,1.0,1.0
LDTH82CX,Hey everyone cool I hope so Im fine was watchin frontlines about vaccines about how it affects kids compared to back in the ss n,0.0,1.0
XA4PE05B,VaccinesNOVA so glad Allison shared her story about autism It is so important for parents to hear that it is not caused by vaccines,1.0,1.0
4HV971QJ, I guess money cant buy a brain vaccineswork vaccinedenieridiot,1.0,1.0
TAWQYTTX,Mmr rocks,0.0,1.0
RE4YLV4S,AMNews Many Americans believe widely discredited health conspiracy theories Is there a link between vaccines url,-1.0,0.3333333333333333
B8FZEJKO,If you shopped at the Gilroy Costco Jan pm you may have been exposed to measles KTVU url,0.0,1.0
EITQ5M4Q,BullsandBears measles think it might be due to illegals released into our population people not vaccinating,1.0,0.6666666666666666
0UZ6GT8I, that is hardly evidence that vaccine is harmful As to the other comment Vaccines do not require live virus,1.0,0.6666666666666666
F25L95CY, i think it mean doctor tricked girl into having sex by making her believe that the vaccine of her fatal disease was his penis,0.0,1.0
7KS841N4,Thanks to Dr Lipkin for pointing out danger of phony science vaccines treatment etc Troubling for any disease and too common phps,-1.0,1.0
6RKOAWFQ,For someone whos in college studying immunology vaccinate your fucking children,1.0,0.6666666666666666
FIX6CNRQ,I want to see an child that has actually been injured by a vaccinevaccine injury isnt an injection site reaction not an apocryphal one,1.0,1.0
V6XGO83Q,Docs plan tests for two Ebola vaccines The World Health Organization plans to test two Ebola vaccines early next url,0.0,0.6666666666666666
2EWLFTIX, what do call someone who wont vaccinate their kids because an actress said so,1.0,0.6666666666666666
EF0SYHQW, MMR requires a booster at some point though you may have gotten it as a kid,1.0,0.6666666666666666
2E3XSDAR,Pa senators propose criminal immunity for kids involved in sex trade State lawmakers are following up last years url,0.0,1.0
GRLF2YMB, Nationalism is an infantile disease the measles of humanityEinstein this is very true,0.0,1.0
E16RE3LZ,Does a vaccine exist for the disease of being busy Great article from url,0.0,1.0
0IGTHRRT,Way to go nonvaccination FREAKS Not only is there a measles outbreak but now pertussis is on the rise and that is life threatening illness,1.0,1.0
IV0OQAG5, my babies were vaccinated and have grown up great Thanks,1.0,1.0
GZL9JJM9,B RocK BlackBarbie Spoken Word MMR by Franchise Liaison Music via soundcloud url,0.0,1.0
9ZHXR8WU,Its World Immunization Week VACCINATE YOUR CHILDREN,1.0,1.0
HOGQ697J,Is it that I seek to bear w them Is it that I see the state of ppls hearts storytelling autism vaccineinjury url,0.0,0.6666666666666666
Y0TLI5RL,am knottsberryfarm disneyland measles The Fortress of Solid Dude url,0.0,1.0
UUSOLOUV, never had the measles never had the mumps Eat a lot of tacos take a lot of dumps freestyle,0.0,1.0
Q2PN68OW,Dont want to vaccinate your kids fine Just dont bring the little plague rats to Disneyland asshats,1.0,1.0
JAVB3NEQ,RT Lies about vaccinations kill people If you treat antivaccination people as credible you are helping kill people,1.0,1.0
4NPKOGW6, Oregon considers bill banning most vaccine exemptions url Yusssssssssss Progress,1.0,1.0
G50KDYYR, Im hoping that someone who injects botulism into her forehead tells us how harmful vaccinations are Oscars,1.0,0.6666666666666666
0ZBP30SJ, Parents who wont vaccinate children to lose welfare payments in Australia url AusPol ,1.0,1.0
9U39UQU7,Phoenix Fire Dept holds free immunization clinic Just take your childs shot records to the Deer Valley Community url,1.0,1.0
9H512NK7,Migrant kids better vaccinated than US kids but Fox News stokes germ fears anyway url,1.0,0.6666666666666666
VZ0O3IDS,Its mostly Europe actually Measles is endemic in England right now because of idiots ,1.0,1.0
VHY3NUZK, perhaps an undiagnosed allergy to eggs or vaccination ingredients But mmr itself didnt kill her,0.0,0.6666666666666666
4GKG3C1Z, MERS now in the US What is the saying one plane ride away At least there is a vaccine for measles,1.0,0.6666666666666666
XZW43YJR,Immunity Support Thieves Products We cant talk about Back to School without talking about url,0.0,0.6666666666666666
5ZM22PK4,Largest outbreak of measles in the US since How to talk to the antivaccination movement url ,1.0,1.0
M1BJHX8C,Health district possible measles cases reported near Reno url,0.0,1.0
TAHGXKXF, Estamos vacunados contra muchas cosas pero an as hay que ponerse refuerzos de ciertas vacunas Recientemente me puse la MMR,0.0,1.0
FS1I54AQ, lol ewww maybe u got Measles,0.0,1.0
N9DIH6JX,How to spot measles in the workplace At first you think you have a coldYou have watery eyes a runny nose and url,0.0,1.0
58ZR9CM0, Measles have hit Arazonia just in time for super bowl,0.0,0.6666666666666666
E5MAKGV0,Health and wellness fair today Free immunizations and Health screaming Till PM Manchester Center pic url,0.0,0.6666666666666666
G4G2Z90O,Stick with science We dont want measles back NoWayDrJay,1.0,1.0
LXCSBBVZ,So now the most Magical Place on Earth has Measles Vaccinate your children people Or stay home Yes you have a choice,1.0,0.6666666666666666
VNHJD1S7,If you dont vaccinate your kid I hope you get polio vaccinateyourkidsalready,1.0,1.0
6B7A0EFI, Serious reactions to vaccines are in a million Chances youll contract measles if unvaxxed ,1.0,1.0
EPLU1RAR,Immunizations for school Oooouch Lol Intown Primary Care url,1.0,0.6666666666666666
5S1HWIN8,Vaccines cause autism debate right now url,-1.0,0.6666666666666666
NNC2OVM3,At the pharmacy getting vaccinated for flu and pneumonia at in Falls Church VA url,1.0,1.0
WYP7D3N2,Heres to hoping none of us contracted measles days until were in the clear url,0.0,0.6666666666666666
LH5Z2AEP,If Progressive Liberalism is the disease Barack Obama may be the vaccination He has certainly stimulated the liberty loving immune system,0.0,0.6666666666666666
95X8JKKZ,Idk why this is still an issue guy even said he was wrong later vaccineurkid KidSoSmart parenting parentingfails url,1.0,1.0
3AE4YAAP,LI Mother Says Vaccine Controversy May Keep Daughter Out Of School The mother of an yearold Sound Beach girl url,0.0,0.6666666666666666
PQ12I2FU, People who complain live longer Releasing tension increases immunity and improves overall health I must be immortal,0.0,1.0
JQK89IX0,Theres also a serious side effect for not vaccinating your kid Its called polio measles mumps and rubella,1.0,1.0
O1XFJCXG, Take action so women amp children worldwide can access vaccines amp education Click to help url ,1.0,1.0
CO2CFY2E,New immunization requirements for Hoosier kids for school year INDIANAPOLIS Indiana kindergartener url,0.0,0.6666666666666666
R9DWMQAC,I got to get a MMR,1.0,0.6666666666666666
Q0VJ6OVP,Measles at HBHS,0.0,1.0
694MZ1UI,SB Engross Schools providing immunity from liability for education employees for use of reasonable force Eff url,0.0,0.6666666666666666
XWZ6DAM6, There is no such thing as a Vaccine preventable disease If that were the case only the,-1.0,0.6666666666666666
V1Q0GWCG,SB Enroll Schools providing immunity from liability for education employees for use of reasonable force url,0.0,1.0
VZTVBXMK, we are on the same page not all vaccines are bad But adults I believe have less tolerance being a nurse My kids were given vac,1.0,0.6666666666666666
0DSXLZTP,My s HealthNut Parents Didnt Vaccinate Me This Is What My Childhood Was Like url important,1.0,0.6666666666666666
5ZZWJD42,No measles please Downtown Disney url,0.0,1.0
VIXXMXH1,WhenIWasAKid my mom got me vaccinated because she understood diseases are InvisibleThreat vaccinesNOVA thanksmom nomeaslesforme,1.0,1.0
LMNHVZ3Z,Disneyland measles outbreak reaches Mexico url,0.0,1.0
5MRXKXK7, Measles in People forget there really is evolution everywhere If u asked her is this evolution World smarter,0.0,1.0
97WS7DJH,Amid measles outbreak one crucial group not required to vaccinate While much of the attention in the ongoing url,0.0,0.6666666666666666
YA0ST308,IDIOT Kristin Cavallari defends her antivaccine stance saying We feel like were making the best decision for our kids,-1.0,0.3333333333333333
N55LDSI5,California law would end personal belief vaccine exemption for children url,1.0,1.0
1541DOCT,Road to k mmr Just winning and having fun with my old buddies P Hehee lt aftiels base url,0.0,1.0
C22C6KUB,watching MMR for the first time Im absolutely in love with ,0.0,1.0
QOJ7IG8W,Important Immunizations to Consider for a Healthy School Year url,0.0,0.6666666666666666
6X9NRJKU,Thomasville mother blames immunization shots on daughters autism url,-1.0,0.6666666666666666
V3U1MS2J,Health officials urge vaccinations after flu hits Maryland Rick Ritter reports url,1.0,0.6666666666666666
J2Y34M3L,The low immunity of the human becomes unsustainable to enable proper brain function Low brain function leads to more lower immunity,0.0,1.0
SF1L1QLH, Parents who do not have their kids vaccinated should be arrested for child abuse,1.0,1.0
RLUFGPSF,State confirms cases of measles in Cook County Lab tests pending for three babies diagnosed with measles at a url,0.0,0.6666666666666666
CUY27WHZ, some of us are hella crunchy but we still understand the basic science of vaccinationsdisease prevention Hippie Smartypants,1.0,0.6666666666666666
WD8ZULCU,AIDS N qHPV vaccine reduces risk costs among older HIVpositive MSM treated for HGAIN url,1.0,0.6666666666666666
QK8IMNIY, Amazing how somebodys firm belief that vaccinations are harmful is changed when their kids get sick Talk about ironic,1.0,1.0
KS0JH2WZ, Im usually immune to it but stress is killing that immunity lol,0.0,1.0
H5FMWXBC,My poor baby is having a reaction to his vaccines today ,0.0,1.0
SY6J029F,AMNews Students put at risk of HIV and hepatitis from botched blood tests and vaccinations sue their former url,0.0,0.6666666666666666
MI40MUHK, If only we had some simple safe way to prevent this from happening sarcasm vaccinate ,1.0,1.0
NH32H68N,So on this Rosa de Guadalupe the parents dont want their kids to get the HIV vaccination lol,-1.0,0.3333333333333333
AE67TGUO,SMDH RT This is not from a measles shot Your small pox vax scar pattern is most typical among African Americans,0.0,0.6666666666666666
J80Q12P1,Takes weeks to clear measles Measles leads to immune suppression late neurologic diseases immune suppression ,0.0,0.6666666666666666
KR9171SS,Amazing how news people attack about child vaccination rather than the economy or our borders,0.0,0.6666666666666666
631QQPK3, Christie is an idiot We saw that when he over reacted on Ebola but wouldnt read on measles,0.0,0.6666666666666666
MRV3CBG2, Pants on Fire for on cause of measles outrbeak url but facts dont matter to followers,0.0,0.6666666666666666
8X0EPRG5,Nigeriabased writer trolls measlesravaged country America on Twitter url,0.0,1.0
H1TR79UK,Was tested for TB inoculated for measles mumps rebella etc had yet ANOTHER tetanus shot amp blood work Back on Wednesday pincushion,1.0,0.6666666666666666
2L4U74HE, Parents that dont immunize their children because of some perceived autism link suck,1.0,0.6666666666666666
OQQI4AD1,Fact blankets keep you safe at night We dont know what from but they are definitely an immunity against something,0.0,1.0
4E3Z1TLC, just ANDREAed me You said I had measles I dont fucks with that,0.0,1.0
Y22KWE4Y, This Wisconsin Republican budget means less life saving vaccinations for kids url,0.0,0.6666666666666666
R0X568K8,There anything to this rhetoric of the border kids spreading disease That shit sounds super racist They have vaccines in Central America,0.0,0.6666666666666666
C87S9M3C,African Nations Celebrate a Percent Drop in Child Mortality Rates Due to Immunization url,1.0,1.0
H2LH43FK, North measles outbreak serious url healthcare,0.0,1.0
ALL5OPML,Toddler dies of measles in Berlin st death in outbreak An monthold boy has died of measles amid an outbreak url,1.0,0.6666666666666666
RUAQAKD9, saturday mt eden childish gambino the vaccines zeds dead group love we were promised jet packs keep Shelly in athens lt ,0.0,1.0
F9185YMK,In relation to my other tweet I definitely believe you should vaccinate your kids,1.0,1.0
PR1AHK6B,Nooo this sucks On avg ppl who complain live longerreleasing tension increases immunity boosts health BetterLateThanNever,0.0,1.0
9C08NX5A,Love is a measles and everyone has to go through this,0.0,1.0
6UF1EI2N,Measles and Your Family Texas Health Allen Shares Information to Help Parents url,0.0,1.0
ZWVVB72A,Hope Massive dose of measles vaccine clears womans cancer url,0.0,0.6666666666666666
3A82YH5A, maybe for certain ones but is there really any reason not to get a measles one Like cmon that disease should be dead by now,1.0,1.0
OB5XIQZI, Please dont let my kid get sick because your goofy ass refuses to vaccinate yours,1.0,1.0
YCRGEYUX, its scary how their refusal of vaccinating can harm or even kill innocent victims ie Infants,1.0,1.0
0VXI2LEM,Isnt it interesting that public health officials never promote the various proven ways to avoid the flu other than through vaccination,-1.0,1.0
6YKZBPKH,Just wrapped up my nursing school clinicals with one last set of immunizations Its getting real,1.0,0.6666666666666666
MP8DJQMW,RT The frightening consequences of the GOPs proposed cuts to the CDCs immunization funding url,1.0,1.0
XUVTC7IW, vaccines KILL babies url,-1.0,1.0
FMG8ARQN,So this NHL a mumps outbreak kinda highlights the importance of vaccinating your kids or something right,1.0,0.6666666666666666
9BL2DEXD,LATEST Several Disneyland employees diagnosed with measles The happiest place on Earth just got a bit sadder url,0.0,1.0
HILIB2DF,Trying to fix my mmr is tough I mean I keep getting mixed up with bad teams I was carrying as a sona tbh ,0.0,1.0
MU0AZP0A,Parenting checklist dont vaccinate kid Take them to Disneyland url,0.0,0.6666666666666666
ZQIENEVQ,RT If unvaccinated youre about k times more likely to die from measles than win at PowerBall url healthcare,1.0,1.0
T7LZPY4K,Courts Rule Vaccines Cause Autism and Brain Damage url,-1.0,1.0
4NIB06CX, The National Vaccine Injury Compensation Program VICP If safe why this,-1.0,0.6666666666666666
W3IY9N7A,Nurse Nancy at the Weekly Breakfast Club on the issue of the need for vaccinations and the recent measles outbreak url,1.0,1.0
A2XL18US,Immunizations save millions of lives and Trillions of Healthcare Dollars Worldwide Your rights end when your actions cause harm to others,0.0,0.6666666666666666
XZXWGQPO,Maybe if The Garage fails Ill become an architect lol I think the MMR building is pretty cool url,0.0,1.0
RBTZ8UON,via Measles Is A Killer It Took Lives Worldwide Last Year url,0.0,1.0
V6IJATBE,Coughing extra on the shuttle and everyone thinks I have the measles VaccinateYourKids,1.0,0.6666666666666666
0RK2FA4F,Cinematic Immunity panelists discuss Sarah Jones and Set Safety url,0.0,1.0
K93VGZBB,Will we have to wait until police officer kills innocent child of legislatorjudge before impunityimmunity stops CopsGoneWild CopBlock,0.0,0.6666666666666666
IKU81W3T,Dear stupid please just shut up already and vaccinate you child health vaccinate scotland,1.0,1.0
S2KZHYJ2,This Mouse Has Evolved An Immunity to Toxic Scorpion Venom url,0.0,1.0
YX10ZW71,Sadly Id much rather have a child grow up with autism than risk my child to a fatal measles outbreak VaccinateYourKids ,1.0,1.0
FTKXP8Z6,spoke this am San Marco rotary club gift was donation in rethreadeds name allowing kids to get polio vaccines url,1.0,1.0
1GMZ4UG6,Fantastic post RT On Autism Vaccines and Love in my Activism url via ,0.0,0.6666666666666666
DFL2HI0G, Oof poor kid Sadly their lack of a DTaP vaccine means their son could also have helped spread pertussis,1.0,0.6666666666666666
81LZ4NOI,Health officials warn of SeaTac measles exposure The Associated Press url,0.0,1.0
J7PL16F8,To be able to fight it off Some will say its a dead strain if its dead how you build up an immunity nithing for body to fight,0.0,0.6666666666666666
62K1KSQC, did you vaccinate any children,0.0,1.0
W59RYJHK,I want to hug my bio professor She goes dont ever pull some jenny McCarthy shit and tell me vaccines cause autism,1.0,0.6666666666666666
OA0FE513,Not really Plenty of diseases are treated unequally but the Ebola vaccine is a terrible example for that point ,0.0,1.0
9CVXYHPA,Damn you people RT Health officials report first suspected case of measles in Tehama County url,1.0,0.6666666666666666
KHWGDTLA, I stand by that If youre too dumb to vaccinate youre a menace Lets bring nearly dead diseases back,1.0,1.0
5UHKNT8V,Vaccines are the craziest thing how do you ever think of making a person not get sick by injecting the disease into them lmao,-1.0,0.6666666666666666
Y9JZW2CC,Listened to MMR for minutes b realized it not XPNs worst song countdown countdown,0.0,0.6666666666666666
K3FMB142,Not doing the homeland homework being steps ahead buying vaccinations from open pharmaceutical in Mexico like you can over the counter,1.0,0.6666666666666666
ZIQKEDR1,MCHD Back to School event tomorrow in parking lot Catch up your kids immunizations sports physicals amp get free school supplies pm,1.0,1.0
QLJUZBJ0,My father has had all his vaccines he comes with bare minimum child support checks and u only gotta see him like once a month adoptplease,0.0,1.0
2NDKAKYZ,millions of people dying from a disease thats been latent because of vaccinations or a few false reports of vaccinations causing illness,1.0,1.0
OKYN1OFA, New Cases Of Measles Reported In North Texas Counties NORTH TEXAS url Officials with url,0.0,1.0
93AAFUAM,If one in ten parents dont follow the vaccine schedule are their kids still allowed in school or day care,0.0,1.0
N544C1DL, and that time him and that crazy lady tried to stop kids from getting vaccinated goodtimes,1.0,1.0
2N8BW32H, unless idiot parents dont vaccinate their kids again,1.0,1.0
CATKUMCZ, ff,0.0,0.6666666666666666
9YP22SQK, Listen ur doc MiaOur bodies dvlop immunity thru grmsIn sampsrich kids more likely get polio thn poorbc homes clnr,0.0,0.6666666666666666
DOAM7Z3W,People need to know the chances of survival from the vaccine vs the chances of survival from the actual disease,0.0,0.6666666666666666
0COTS8JW, who complain tend to live longer Releasing tension increases immunity and improves overall healthi complain a lot,0.0,1.0
T53N96E7, when I initially clicked that it led me to some link about some pregnant girl who decided to vaccinate her baby,0.0,0.6666666666666666
20Y27492,READ THIS Heartbreaking letter by Roald Dahl about daughters death from measles Vaccinate url url,1.0,1.0
KU7AQLFG,RT Jenny McCarthy issues fatwa against Susanne Atanus for suggesting God caused autism as punishment for gay marriage not vaccines fb,-1.0,0.6666666666666666
